"Status","Start Time","Stop Time","Duration in ms","Parent Suite","Suite","Sub Suite","Test Class","Test Method","Name","Description"
"passed","Sat Jun 17 16:50:14 GMT 2023","Sat Jun 17 16:50:21 GMT 2023","6674","tests.ui_tests","test_review_page","TestReviewPage","","","User can leave a review","User can leave a review"
"passed","Sat Jun 17 16:50:22 GMT 2023","Sat Jun 17 16:50:22 GMT 2023","0","tests.unit_tests","test_user","TestUnit","","","SMS generates correctly","Checks a send sms method "
"passed","Sat Jun 17 16:50:22 GMT 2023","Sat Jun 17 16:50:22 GMT 2023","2","tests.unit_tests","test_user","TestUnit","","","Service creates in DB","Checks that service creates in DB"
"passed","Sat Jun 17 16:50:21 GMT 2023","Sat Jun 17 16:50:22 GMT 2023","1302","tests.unit_tests","test_user","TestUnit","","","Password hashes correctly","Checks a password hashing method"
"passed","Sat Jun 17 16:50:22 GMT 2023","Sat Jun 17 16:50:22 GMT 2023","1","tests.unit_tests","test_user","TestUnit","","","Review creates in DB","Checks that review creates in DB"
"passed","Sat Jun 17 16:49:54 GMT 2023","Sat Jun 17 16:50:04 GMT 2023","9891","tests.ui_tests","test_account_page","TestAccountPage","","","User can add a service","User can add a service"
"passed","Sat Jun 17 16:50:05 GMT 2023","Sat Jun 17 16:50:13 GMT 2023","8176","tests.ui_tests","test_account_page","TestAccountPage","","","User can change his data","User can change his own profile"
"passed","Sat Jun 17 16:50:21 GMT 2023","Sat Jun 17 16:50:21 GMT 2023","3","tests.unit_tests","test_user","TestUnit","","","User creates in DB","Checks if DB creates and user can appear in it"
